{
  "id": "evt_01h8x9k2m3n4p5q6r7s8t9u0v1",
  "status": "confirmed",
  "start_time": "2026-06-20T14:00:00Z",
  "end_time": "2026-06-20T14:30:00Z",
  "duration": 30,
  "buffer_before": null,
  "buffer_after": null,
  "original_start_time": null,
  "attendees": [
    {
      "id": "att_01h8x9k2m3n4p5q6r7s8t9u0v2",
      "name": "Jane Smith",
      "email": "jane.smith@example.com",
      "time_zone": "America/Chicago",
      "status": "accepted"
    }
  ],
  "conferencing": {
    "join_url": "https://zoom.us/j/123456789",
    "meeting_id": "123456789",
    "integration_type": "zoom"
  },
  "payment": null,
  "scope": {
    "id": "scp_01h8x9k2m3n4p5q6r7s8t9u0v3",
    "name": "Sales Team",
    "slug": "sales-team"
  },
  "created_at": "2026-06-13T10:00:00Z",
  "updated_at": "2026-06-13T10:00:00Z"
}
